Title,Star Rating,Main Content,Review Date
Quick easy and fixed!!,Rated 5 out of 5 stars,Quick easy and fixed!!,2024-05-24T08:18:32.000Z
The claims representative was courteous…,Rated 5 out of 5 stars,The claims representative was courteous and knew her job.,2024-05-24T07:40:52.000Z
Terrific sales people and a very…,Rated 5 out of 5 stars,Terrific sales people and a very compassionate woman named Carol who helped me when I had to cancel.,2024-05-24T03:22:54.000Z
They did a great job helping me and…,Rated 5 out of 5 stars,They did a great job helping me and giving me information I might need.,2024-05-24T03:10:13.000Z
Carshield gave the tow company my wrong…,Rated 4 out of 5 stars,"Carshield gave the tow company my wrong cell number, they tried to call me two times before someone picked up and said that they no longer needed tow service. It took three calls to finally get a tow truck to get to me",2024-05-24T02:04:12.000Z
Quick to cover part with trouble,Rated 5 out of 5 stars,Quick to cover part with trouble Very happy with representative Awesome,2024-05-24T02:03:58.000Z
Car shield was Awesome....I've been…,Rated 5 out of 5 stars,Car shield was Awesome....I've been paying my monthly premium for a few yrs now ...my jeep needed help and Carshield did what they promised ...and it was so easy...my dealership contacted carshield and the rest was seamless...I would strongly recommend Car Shield!!!!,2024-05-24T01:52:19.000Z
Gladly the only thing I've done so far…,Rated 4 out of 5 stars,Gladly the only thing I've done so far as sign up and do automatic payments be easier to tell you about my experience unfortunately if I ever actually need it,2024-05-24T01:52:16.000Z
Called and left several messages with…,Rated 1 out of 5 stars,"Called and left several messages with American Auto-Shield per instructions from CarShield representatives.Never a call back.I'm looking for a new company for coverage. Checking with Endurance. American Dream and others for price quotes.Good bye CarShield. Nearly five years, never a claim.",2024-05-24T01:34:42.000Z
Car Shield is great,Rated 5 out of 5 stars,"Between Car Shield and my repair shop, they came to a great deal which cost me very little for which I’m one happy senior citizen.",2024-05-24T01:25:11.000Z
Agent was knowledgeable and courteous,Rated 5 out of 5 stars,Agent was knowledgeable and courteous,2024-05-24T01:22:54.000Z
It's just a great overall company.,Rated 5 out of 5 stars,,2024-05-24T00:45:10.000Z
CarShield is the best ever ❤️ so glad…,Rated 5 out of 5 stars,CarShield is the best ever ❤️ so glad I'm a customer this company is awesome it does everything it's suppose to!!,2024-05-24T00:44:32.000Z
I had issue with my alternator and…,Rated 5 out of 5 stars,"I had issue with my alternator and called car shield and they where right on it fast and to the point,",2024-05-24T00:31:26.000Z
Your representatives was very patient…,Rated 5 out of 5 stars,Your representatives was very patient and very was very knowledgeable about your product,2024-05-24T00:16:13.000Z
Everything went smoothly,Rated 4 out of 5 stars,"Everything went smoothly. The radiator was covered, I was just disappointed the thermostat wasn't included. I has to pay for that and the deductible.",2024-05-24T00:12:50.000Z
Good phone call and fine customer…,Rated 5 out of 5 stars,Good phone call and fine customer service.,2024-05-24T00:08:58.000Z
The Representative Matika Was Excellent,Rated 5 out of 5 stars,"The representative Matika was pleasant, professional, caring, resourceful, and a problem solver. I had recently purchased a luxury car and wanted to be sure I had a warranty, and it was affordable. Matika searched for options to help me, and I am very grateful for her assistance. I highly recommend her and thank you for your excellent professionalism.",2024-05-23T23:33:36.000Z
Very fast and courteous,Rated 5 out of 5 stars,Very fast and courteous,2024-05-23T23:28:53.000Z
Thank you for your support and great…,Rated 5 out of 5 stars,Thank you for your support and great services,2024-05-23T23:24:08.000Z
Was very easy to find a good mechanic…,Rated 5 out of 5 stars,Was very easy to find a good mechanic that took car care. Glad I bought this program,2024-05-23T22:56:13.000Z
Carshield informed provided me all the…,Rated 1 out of 5 stars,"Carshield informed provided me all the items that would be covered. When I filed the claim they gave me a bogus excuse why they were not going to cover the issue. The reason was based off a speculation even though the repair shop told them what the cause was. 1. the told me that I would be able to file a claim on may 10th when I first set up an account with them back in april. (25 days from the pay date). I told me case in on may 13th. rep told the repair shop claim would not start till 15th(lied). When I called back another rep said that was a mistake and my claim started on the 11th.2. Inspector came out confirmed that the issue was internal on 5/21. Then today (5/23), they called and told the repair shop that per their ""assumption"" it looked like it was an outside cause and they denied the claim. so one day is deemed approved and other day it isn't! 3.when I called today, they gave me bogus info that I continued to drive the car while damaged plus all the other crap info that said. That isn't correct because when I first notice the sound, smell and leaking of oil I went to the shop and dropped the car off. How are you going to tell me what I did and didn't do.  4. Carshield finds a way not to cover anything. Why am i paying for a warranty service that don't cover what was told. So that is fraudulent info provide to get my business. I have paid two month and received no assistance. And now they are tell me they wont refund me my money They lied to get my business, repair shop provided them all the info they needed and proof of damage. every person has a different response. One min Im covered, the next im not. **when the repair shop asked them why the feel that this isnt covered, they couldnt give them a direct answer. Its want it felt, how it looks to him. that is not a accurate answer. **",2024-05-23T22:52:19.000Z
I have had CarShield for 2+ years now…,Rated 5 out of 5 stars,I have had CarShield for 2+ years now and I just love it. CarShield really comes in handy and I would recommend them to any and everybody! They are so worth it and definitely needed in every which way. I love the customer service as well. The employees are so nice and very helpful as well!,2024-05-23T21:29:18.000Z
Great service when my vehicle needed…,Rated 5 out of 5 stars,Great service when my vehicle needed repairs,2024-05-23T21:09:50.000Z
Very pleasant,Rated 5 out of 5 stars,Very pleasant,2024-05-23T21:08:40.000Z
All I've done is start coverage and…,Rated 4 out of 5 stars,All I've done is start coverage and make payments,2024-05-23T21:06:47.000Z
Major Disappointment,Rated 1 out of 5 stars,Too my car in for repairs all went well all got approved including my rental then my my mechanic found out that the motor needs major repairs that’s when yesterday a got a email saying that I was denied cause I bought the car in 1 day too soon for the waiting period so why do u approved it in the first place I’ve been with you guys since last August with a different car that I donated cause was too old then I switched for this one can someone please look into this,2024-05-23T19:46:11.000Z
The people there are very helpful and…,Rated 5 out of 5 stars,The people there are very helpful and very courtesy when they help their customers.,2024-05-23T19:23:08.000Z
My Credit Card was compromised and…,Rated 5 out of 5 stars,My Credit Card was compromised and Crystal changed the payment for my 2 policies with Car Shield without hesitation and was very nice!,2024-05-23T19:22:32.000Z
Absolutely Amazing ❣️,Rated 5 out of 5 stars,,2024-05-23T19:18:54.000Z
I called to make a payment,Rated 3 out of 5 stars,"I called to make a payment. I asked if the same rate was available for 6 months. The young woman told me the rate was available and took my information.That is the job, right?",2024-05-23T19:14:16.000Z
Professionalism and clear information…,Rated 5 out of 5 stars,Professionalism and clear information from customer service associate.,2024-05-23T18:48:18.000Z
I have not ordered anything from…,Rated 1 out of 5 stars,I have not ordered anything from carshield,2024-05-23T18:42:16.000Z
Unable to update my card on the app…,Rated 5 out of 5 stars,"I was unable to update my card on the app, therefore I called customer service for assistance.",2024-05-23T18:38:48.000Z
Just called to make my diamond status…,Rated 5 out of 5 stars,Just called to make my diamond status was in affect.,2024-05-23T18:22:13.000Z
Was getting the run around without an…,Rated 1 out of 5 stars,"Was getting the run around without an answer nobody can help me, your tv advertising is all lies,I will not recommend your services to anyone",2024-05-23T18:14:47.000Z
You say your here to help why do I keep…,Rated 1 out of 5 stars,You say your here to help why do I keep hearing the sane thing every time I call ???? Wait 24 hrs and all will be magical !!!!° come on now,2024-05-23T18:09:26.000Z
Fast in the process.,Rated 5 out of 5 stars,,2024-05-23T17:27:51.000Z
Answered the claim very quickly with…,Rated 5 out of 5 stars,Answered the claim very quickly with the repair shop thanks,2024-05-23T17:17:04.000Z
I was taken care promptly,Rated 5 out of 5 stars,"I was taken care promptly, part was sent immediately., and car was fixed next day.  Awesome.!!!!!",2024-05-23T17:14:10.000Z
First Time Buyer,Rated 4 out of 5 stars,I felt that the person who  I dealt with was a bit to high pressure  for my liking.  He was very knowledgeable and did the very best he could to make sure I got great coverage.,2024-05-23T17:02:46.000Z
She explained every to me,Rated 5 out of 5 stars,,2024-05-23T16:54:29.000Z
My experience with car shield has been great.,Rated 5 out of 5 stars,My experience with car shield has been wonderful. All of the business was handled between the dealership &   car shield seamlessly.,2024-05-23T16:53:37.000Z
Broke down  while heading to Ohio on a…,Rated 5 out of 5 stars,Broke down  while heading to Ohio on a trip.  Carsheild was helpful with getting me to a repair facility. An vehicle being repaired.  Little bit of a wait on getting a rental. But was able to get a rental and back on my way. Thanks again Carsheild!!,2024-05-23T16:48:01.000Z
Peace Of Mind,Rated 5 out of 5 stars,"I'm blown away with the courteous, knowledgeable and professional staff I received undivided attention before making my decision to purchase an extended warranty.  I was completely happy with the service I was given and the cost was affordable for my budget....Happy customer and I will refer my friends and family to go with carshield.",2024-05-23T16:41:20.000Z
Good response,Rated 5 out of 5 stars,Good response from you,2024-05-23T16:32:18.000Z
Your Representatives listened to our…,Rated 5 out of 5 stars,"Your Representatives listened to our concerns & helped us with a great coverage tofit our budget. I had lost my bank debit card, called you to give the new one so our payment could be deducted properly on June 4, 2024 & each month after that on the 4th of every month. You took care of it. Thank You@@",2024-05-23T16:19:35.000Z
I was under the impression that you all…,Rated 1 out of 5 stars,"I was under the impression that you all covered more than what you do. I was told that you all determine what kind of coverage that the owner of the policy gets. That’s not how it should be. The policy owner should be able to determine what they want and can pay for. The owner should be be able to purchase what they need,want, and or can afford. Now I am without my car and can’t afford at this time to pay for what my car needs. I had to choose between food and fixing my car. So now I can’t afford to get my car fixed or pay your company because I have to feed my family.",2024-05-23T16:14:10.000Z
The customer service representative was…top notch...,Rated 5 out of 5 stars,"The customer service representative was very polite, knowledgeable, courteous and helpful, my issue was resolved on my first call... thanks",2024-05-23T16:10:07.000Z
Being a member of Car Shield has been…,Rated 5 out of 5 stars,Being a member of Car Shield has been such a BLESSING to have. I had to use Car Shield twice and was very pleased with the prompt payment to the Mechanics.,2024-05-23T15:36:58.000Z
On time,Rated 5 out of 5 stars,On time ! Very professional,2024-05-23T14:50:51.000Z
Fast response time and friendly and…,Rated 5 out of 5 stars,Fast response time and friendly and knowledgeable staff,2024-05-23T14:16:04.000Z
All questions were answered,Rated 5 out of 5 stars,All questions were answered,2024-05-23T14:09:42.000Z
Did not cover all the repair.,Rated 4 out of 5 stars,"They responded,but when it comes to coverage all the way,they do not cover 100% of the claim. The labor costs are not covered and I’m still coming out of pocket $750.00 for my transmission.",2024-05-23T13:28:42.000Z
I was happy to find a great mechanic,Rated 5 out of 5 stars,I was happy to find a great mechanic. I called car shield.  Found a place to get my car fixed & it was done. You saved me so much money. Couldn't of been easier.,2024-05-23T13:14:24.000Z
Fraud my transmission you guys would…,Rated 1 out of 5 stars,Fraud my transmission you guys would not repair.  I do not agree with you response.  The transmission is covered. This particular part is PART OF THE TRANSMISSION+,2024-05-23T13:08:59.000Z
Was easy to call and got someone who I…,Rated 5 out of 5 stars,Was easy to call and got someone who I could understand and solve my problem,2024-05-23T12:55:25.000Z
I am giving Carshield 1 star only…,Rated 1 out of 5 stars,"I am giving Carshield 1 star only because they answered the phone. We were misinformed when speaking to them about their plans. We have had carshield for almost 18 months now and tried to file a claim. Our car has been serviced and repaired at the dealership since day one. Unfortunately the manufacturers extended warranty ran out so we had to buy another warranty. The repair that is needed cost less than what we have paid into carshield. Carshield refuses to honor the claim because they want to send our dealership/ service center the cheapest part they can find. Our service center will not do the work with anything less than an OEM part. So we have an issue. We canceled Carshield. They will not refund our money. And we are stuck paying for the repair out of pocket. Had the Carshield sales person been 100% upfront  on the phone about what parts they will pay for, we would have never used Carshield and tried another company.",2024-05-23T12:21:32.000Z
Excellence in answering all my Q.,Rated 5 out of 5 stars,,2024-05-23T12:07:09.000Z
Everyone with whom I interacted in all…,Rated 5 out of 5 stars,"Everyone with whom I interacted in all departments was courteous, knowledgeable, and thorough.",2024-05-23T08:21:13.000Z
Started out strong with customer…,Rated 4 out of 5 stars,"Started out strong with customer service, getting my car towed, and getting it to a Chevrolet dealership. However, all of a sudden I didn’t have the support I needed nor did the customer service, technician, at the dealership. Phone calls weren’t returned. It’s like we disappeared. Hoping things get better right away.",2024-05-23T04:41:14.000Z
your pleasant personality,Rated 4 out of 5 stars,your pleasant personality,2024-05-23T04:30:57.000Z
Car Shield has been professional.,Rated 5 out of 5 stars,,2024-05-23T04:27:05.000Z
Your representative answered my…,Rated 5 out of 5 stars,Your representative answered my question and sent me a copy of my policy.,2024-05-23T04:11:44.000Z
Worthless!!,Rated 1 out of 5 stars,Did not cover anything needing repair.So much for peace of mind.,2024-05-23T03:58:58.000Z
They listened to what I needed my…,Rated 5 out of 5 stars,They listened to what I needed my second membership,2024-05-23T03:44:21.000Z
Excellent so far,Rated 5 out of 5 stars,"Info was quick. My deductible  was $200 but the bill was $230, so I didn't use car shield. Other than that all is good.",2024-05-23T03:27:59.000Z
Outstanding.,Rated 5 out of 5 stars,Outstanding.,2024-05-23T03:20:50.000Z
Done a real good job for me,Rated 5 out of 5 stars,,2024-05-23T03:18:41.000Z
Took way too long to get an adjuster…,Rated 3 out of 5 stars,"Took way too long to get an adjuster out to see my truck. It took 2 weeks ti send  an adjuster then another week to getvthe report. Once authorization was granted, my shop took 2 or 3 days to get me my truck back.",2024-05-23T02:32:05.000Z
WOW CARSHIELD IS FAKE and HORRIBLE,Rated 1 out of 5 stars,"WOW did I miss this. I have paid in over $4,000 since 2020 for Car Shield only to find out when my car broke down last week they were not covering the part. What made it worse was when I went to rent a rental car. I was told my case was closed yet it was open 3 hours before my request. The company is a total Joke, don't believe the commericals it's BS!!!!!!!!!!!!!!",2024-05-23T02:22:46.000Z
Car ok so far but like the reminders.,Rated 5 out of 5 stars,Car ok so far but like the reminders.,2024-05-23T02:18:52.000Z
Thank you I've been with you all since…,Rated 5 out of 5 stars,Thank you I've been with you all since 2021 first time ever using car Shield.  I was a little surprise on how everything  was handel and all I had to pay. But I'm so grateful  for what you all did pay and thank you for taking good care of me.,2024-05-23T01:45:58.000Z
Customer service was able to help me!,Rated 5 out of 5 stars,Customer service was able to help me update my credit card information.,2024-05-23T01:12:28.000Z
Carg,Rated 1 out of 5 stars,When it time to pay for sometimes major they have a problem and don’t like Answering phones call and the Deductible is 250 False Advertiser,2024-05-23T00:40:27.000Z
The woman l spoke with guided me…,Rated 5 out of 5 stars,The woman l spoke with guided me through and resolved my situation very nicely. She was pleasant to talk with and p.s. she spoke perfect English,2024-05-23T00:39:29.000Z
Lack of follow through,Rated 3 out of 5 stars,"I brought my car into pep boys on saturday. My air conditioning went out. Pep boys contacted you to get authorization, I was called by you to ask if it was okay to use your parts instead of what pep boys had. I said that was fine. You were supposed to send the parts that day, It took three days for you to get them out there. That was not good.",2024-05-23T00:32:39.000Z
The Adjuster called me and explained to…,Rated 5 out of 5 stars,The Adjuster called me and explained to me what to do when i get to the repair shop. Give the dealership the adjuster mumber. And boom best customer service i have ever had with carshield and the dealership.  The turn around was great.,2024-05-23T00:21:56.000Z
Dependable courteous staff…,Rated 5 out of 5 stars,Dependable courteous staff knowledgeable.,2024-05-22T23:59:30.000Z
More than what I expected.,Rated 5 out of 5 stars,More than what I expected.,2024-05-22T22:59:41.000Z
Car Shield has never let me down when I…,Rated 5 out of 5 stars,"Car Shield has never let me down when I am needing to have my car serviced from my mechanic. My car is 13 years old and I am retired on a fix budget.  However, I decided to invest in Car Shield knowing that I would never be able to afford a new car. Plus this car was my retirement dream car that I always wanted.  Thanks to Car Shield has given me a sense of security when my car needs to be serviced. Thanks Car Shield!",2024-05-22T21:37:34.000Z
Great very easy to take care of my…,Rated 5 out of 5 stars,Great very easy to take care of my problem,2024-05-22T21:27:41.000Z
MOst of the people are extremely nice…,Rated 4 out of 5 stars,MOst of the people are extremely nice and helpful.  Unfortunately I had one person call me that didn't tell me her name and when I asked for her phone number to call her back I was told it was on my phone and then she hung up.  Very rude!,2024-05-22T20:54:50.000Z
I really don’t have much to say at this…,Rated 5 out of 5 stars,I really don’t have much to say at this time. I just signed up for CarShield. The representative was polite answered all my questions and I understood him. Thank you!,2024-05-22T20:53:17.000Z
My  helper was Joe he really did his…,Rated 5 out of 5 stars,My  helper was Joe he really did his best to help me.Your Web site was down. I need my Car Shield  mobile back on my  phone ASAP. Please email me back when your site working.Thanks Ms. Woodson,2024-05-22T20:37:06.000Z
Excellent service!,Rated 5 out of 5 stars,I spoke with Mikeira who was very helpful and explained everything thoroughly.,2024-05-22T20:25:34.000Z
My experience with Car Shield,Rated 5 out of 5 stars,"All of my experiences have been great 👍.  They are on time, courteous and helpful.",2024-05-22T19:55:59.000Z
professional experience with agent work…,Rated 5 out of 5 stars,professional experience with agent work was done in a timely manner without hesitation,2024-05-22T19:33:09.000Z
I was given a friendly reminder that my…,Rated 5 out of 5 stars,"I was given a friendly reminder that my payment didn’t process on time,  I realized I hadn’t completed my $$ transfer.  I’m impressed that Car Shield showed compassion and realize we all make mistakes.  In today’s world I didn’t expect that.  The lady I spoke to was very friendly and understanding.  I will recommend Car Shield to others",2024-05-22T19:32:16.000Z
The agent was very polite and…,Rated 5 out of 5 stars,The agent was very polite and knowledgeable,2024-05-22T19:16:24.000Z
Excellent customer service,Rated 5 out of 5 stars,Excellent customer service. Representative took the time to review my coverage!,2024-05-22T18:58:54.000Z
You guys didnt cover all my repairs.,Rated 1 out of 5 stars,,2024-05-22T18:03:53.000Z
Excellent service,Rated 5 out of 5 stars,"Hi, it’s everything I expected and more couldn’t be more grateful. Thank you Steve PRIMO.",2024-05-22T18:00:00.000Z
I called because I needed to update update payment information my…,Rated 5 out of 5 stars,"I called because I needed to update my payment infant the representative was very helpful! He was fast, considerate, and helpful!",2024-05-22T17:53:59.000Z
They won’t replace with original parts.,Rated 3 out of 5 stars,They handle claim well. But I disagree with the adjuster refusing to pay for original replacement part. Manufactured parts have no warranty and typically don’t last as long.,2024-05-22T17:53:14.000Z
Cancellation,Rated 4 out of 5 stars,You cancelled my coverage when I asked.,2024-05-22T17:34:57.000Z
Superior Customer Service,Rated 5 out of 5 stars,"I was treated with utmost courtesy and respect by thoroughly knowledgeable customer service representatives. My ""issue"" was resolved quickly and effectively.",2024-05-22T17:11:18.000Z
Could you please send me the…,Rated 5 out of 5 stars,Could you please send me the instructions for what I need to do when I need you?,2024-05-22T17:06:41.000Z
Don't buy from dealerships BUY from CarShield,Rated 5 out of 5 stars,I can't explain how much having CarShield has reduced my stress about my car going forward.  I have always purchased dealership warranties and when I had to used them always seemed to have got you clauses that made the warranty useless.  CarShield did what I was promised from a minor issue and I know my car is protected as long as I keep up with maintenance.,2024-05-22T17:00:00.000Z
Everything went as smooth as it has in…,Rated 5 out of 5 stars,Everything went as smooth as it has in the past,2024-05-22T16:54:01.000Z
Do and donuts Available and knowledgeable hires,Rated 5 out of 5 stars,"Available and knowledgeable hires.  Well done.  Have recommend to family across America. Price negotiable according to need as related concerning what the plan originally set up, but wouldn't apply as a NEED. Price adjustment was a surprise.  Ask for discount.",2024-05-22T16:18:20.000Z
They finished my suv in a timely…,Rated 5 out of 5 stars,They finished my suv in a timely manner. I will definitely go back.,2024-05-22T14:56:57.000Z
The person I talked was very helpful…,Rated 4 out of 5 stars,The person I talked was very helpful and knowledgeable with my problem.,2024-05-22T14:24:30.000Z
To get fast service from Warranty when needed.,Rated 5 out of 5 stars,"Carshield takes care of your car quickly when you need covered repairs done on your automobile. Carshield has helped me last week and a few times over the last few years as needed, I will keep them around.",2024-05-22T14:12:38.000Z
very pleasent person,Rated 5 out of 5 stars,"very pleasent person, very knowledgeable",2024-05-22T13:55:20.000Z
You were quick to pay for my repairs…,Rated 5 out of 5 stars,You were quick to pay for my repairs and I was a little nervous that you wouldn’t but you did. Thank You,2024-05-22T13:49:43.000Z
I spoke to 3 different gentlemen,Rated 1 out of 5 stars,"I spoke to 3 different gentlemen.  The first was a Mr. Ronald Brown, who was excellent.  I explained I was considering cancelling coverage for my 2021 Chrysler Pacifica. I completely changed my mind after speaking with him.  He offered me a new deal for both cars but the call disconnected.  I called back but couldn’t get Mr. Brown, instead I was connected to a complete jerk, whose name I did not get.  when I explained the same situation to him, he became short fused and curt in his responses to me and said Mr. Brown shouldn’t have quoted me the prices he quoted me.  I asked for a manager.  In the meantime, our call dropped and the next thing i received was an email from him saying my coverage for the 2021 had been cancelled.  He had a nasty attitude and I didn’t like it one bit,",2024-05-22T13:10:47.000Z
