Title,Star Rating,Main Content,Review Date
Porch 100.,Rated 5 out of 5 stars,The customer service representative was knowledgeable and helpful to me as he answered all my questions and take care of my needs thanks again  my name is Deslie Lawrence.,2024-04-21T17:03:20.000Z
I needed to update my payment method …,Rated 5 out of 5 stars,"I needed to update my payment method  and Katrina took care of that very quickly and politely, advised me of another method of paying and asured me I could do so at a later date easily, an easy transaction .",2024-04-21T16:56:38.000Z
Paid the fee right away!!,Rated 5 out of 5 stars,,2024-04-21T16:54:31.000Z
Quick response and knowledgeable…,Rated 5 out of 5 stars,Quick response and knowledgeable associates,2024-04-21T14:21:10.000Z
Super excited!,Rated 5 out of 5 stars,"I'm excited to have CarShield because the quick response an very knowledgeable staff.  I had a unexpected engine problem an after reporting it to CarShield along with my vehicle maintenance records,  there was no problem proceeding with the repairs!",2024-04-21T12:53:30.000Z
Great service,Rated 5 out of 5 stars,Great service,2024-04-21T08:44:40.000Z
The people were nice & polite awesome…,Rated 5 out of 5 stars,The people were nice & polite awesome customer service made sure I got the coverage I needed for a reasonable low price would I recommend carsheild to a friend yes I would,2024-04-21T06:22:04.000Z
THIS  OMPANY IS THE BEST,Rated 5 out of 5 stars,,2024-04-21T04:35:28.000Z
The matter was resolved quickly.,Rated 5 out of 5 stars,The matter was resolved quickly.,2024-04-21T01:59:22.000Z
Polite my call. concise to the point and helpful.,Rated 5 out of 5 stars,Polite concise to the point and helpful.,2024-04-21T01:57:53.000Z
Payment Issues,Rated 3 out of 5 stars,,2024-04-20T23:49:06.000Z
I was extremely pleased with Car,Rated 5 out of 5 stars,I was extremely pleased with Car Shield. They worked with my dealership and paid for a car rental while my car was being serviced. I had heard many horror stories about paying for this type of insurance only to find the companies did not pay for repairs. This did NOT  happen with Car Shield. I would refer my friends and family to this company. Thank you Car Shield!,2024-04-20T22:59:36.000Z
Fast reliable service,Rated 5 out of 5 stars,,2024-04-20T22:33:16.000Z
Quick direct to the point service,Rated 5 out of 5 stars,Wonderful quick response in service within an hour or less thanks car shield,2024-04-20T20:25:19.000Z
This company convince me to stay with…,Rated 5 out of 5 stars,This company convince me to stay with them. As I almost went to a different company. They offered me a great deal I couldn't resist.,2024-04-20T18:57:10.000Z
Repairs not covered under contract,Rated 1 out of 5 stars,"Car Shield approved towing to dealership for repairs. Dealership advised needed repairs not covered under my contract.  Requested that you provide me with a printed list of items covered under my contract.  Told would email list and also send a hard copy through mail per my request.  To date have not received email nor hard copy as promised.  Paid  $371.73 to replace an oil presser sensor because without the replacement I could not drive the vehicle.  Navigation screen repair also not covered.  Did not authorize navigation screen repair due to out-of-pocket cost.  Unhappy because you advertise that over 5,000 parts and repairs are covered and yet my repairs were not covered and you have not honored my request for a printed list of services covered under my contract.",2024-04-20T18:13:50.000Z
Fast and efficient response,Rated 5 out of 5 stars,The representative quickly answered my questions and took action to resolve my issue.,2024-04-20T18:02:32.000Z
Everything was easy and not difficult.,Rated 5 out of 5 stars,,2024-04-20T17:44:20.000Z
New Customer,Rated 5 out of 5 stars,I recently signed up with Car ShieldI had Endurance and my claim was denied because the parts my car needed wasn’t on the parts listCar Shield gave me a better price so I will see if they work outCustomer Service when I called was courteous and helpful,2024-04-20T17:42:17.000Z
"Knee Replacement -Plano, Tx.Two days after having a total right…",Rated 5 out of 5 stars,"Two days after having a total right knee replacement, lying in a hospital bed, my wife had mechanical / IT issues with car.I called Car Shield from my hospital bed, called my repair shop and they worked together to fix my wife’s car.I received continuous updates from my repair shop and Car Shield as they repaired my wife’s car.I am now recovering from my surgery at home.  My wife picked up her car and is extremely happy with the entire experience.It let me start recovery and not worry about my wife’s car.  When my vehicle goes out of warranty, it will be added to my Car Shield program Thanks Car Shield",2024-04-20T17:29:19.000Z
Excellent!,Rated 5 out of 5 stars,,2024-04-20T16:40:49.000Z
Easy to work with,Rated 5 out of 5 stars,"Easy to work with, they covered most of what I  needed to have repaired",2024-04-20T15:55:24.000Z
It was great,Rated 5 out of 5 stars,It was great,2024-04-20T15:50:01.000Z
The representatives are always…,Rated 5 out of 5 stars,"The representatives are always professional,courteous, patient and cari g about the customer's needs.",2024-04-20T15:46:48.000Z
Carshield was fast and efficient they…,Rated 5 out of 5 stars,Carshield was fast and efficient they solved my issues without any issues,2024-04-20T15:26:34.000Z
Highly recommend,Rated 5 out of 5 stars,CarShield worked directly with the dealership service to get my car repaired in a timely manner.  Highly recommend this company to cover your car.,2024-04-20T14:36:42.000Z
The customer service,Rated 5 out of 5 stars,"The customer service. They were kind, courteous,knowledgeable, and we resolved the issue",2024-04-20T14:21:59.000Z
Awesome service !,Rated 5 out of 5 stars,,2024-04-20T14:12:35.000Z
I really love my car shield,Rated 5 out of 5 stars,I really how when something  get wrong with your car an you call to make sure it's covered an will help you find a place that accepts  them for u an they pay the claim  the same day no.waiting  an my Deductible  wasn't high at all I really love be a car shield  customer  love u car shield,2024-04-20T04:21:58.000Z
Great customer service,Rated 5 out of 5 stars,Great customer service,2024-04-20T02:40:52.000Z
Liftgate problems with SUV.,Rated 5 out of 5 stars,"Had problems with the hydraulic lift units on my back liftgate of my Palisade SUV.  Contacted CarShield, and was instructed on how to simply file my claim via my certified local mechanic to get the covered repairs completed quickly and completely.  Thanks CarShield!",2024-04-20T02:29:04.000Z
Nice vehicle,Rated 5 out of 5 stars,Nice vehicle. Great employees.,2024-04-20T02:02:47.000Z
I called to cancel my contract after…,Rated 1 out of 5 stars,"I called to cancel my contract after two years of faithfully paying my bill. My payment was charged every month on the 11th and I cancelled at 8am on the 11th. So because Car Shield charged me before 8am snd I cancelled at 8am I ended up paying for a full month’s coverage after I cancelled and turned in my car. I spoke to two different people snd got a “ sorry , that’s our policy. What a great way to treat a good customer. Needless to say when it comes time to purchase another extended warranty I will go elsewhere. I can’t believe you would lose future business over $99.",2024-04-20T01:48:49.000Z
The customer service I received today…,Rated 5 out of 5 stars,"The customer service I received today was excellent!! The representative was professional, courteous and knowledgeable.",2024-04-20T01:43:12.000Z
Peace of mind!,Rated 5 out of 5 stars,"I'm a new member, 2 months in now.",2024-04-20T01:35:24.000Z
Had no problem with my claim,Rated 5 out of 5 stars,Had no problem with my claim,2024-04-20T00:52:57.000Z
My Engine Running Hot And Leaking  Oil…,Rated 1 out of 5 stars,My Engine Running Hot And Leaking  Oil The TV Commercials  Vivica Foxx And  Ice T Says U Cover Over 6000 Parts But YOU WON'T Cover My Repairs  I Appreciate  What You Have Repaired But  I Can't Afford to Pay The Other  $6000 In Repairs,2024-04-20T00:45:05.000Z
The service was quick and precise and…,Rated 5 out of 5 stars,The service was quick and precise and taken care on the first call.,2024-04-20T00:40:02.000Z
my credit card was breached and I was…,Rated 5 out of 5 stars,my credit card was breached and I was issued a new card by the credit card company.  I needed to change the credit card number on my account with CarShield so my payment would go through.  They were very helpful and made the changes in short order.,2024-04-20T00:36:50.000Z
Solve my concerns,Rated 5 out of 5 stars,Solve my concerns,2024-04-20T00:33:14.000Z
Your staff is very courtesy and…,Rated 5 out of 5 stars,Your staff is very courtesy and knowledgeable about your business. Thank for allowing me to be apart of your team.,2024-04-20T00:16:08.000Z
Great communication,Rated 5 out of 5 stars,"Unfortunately this is my 2nd time having to use car shield, but each time it was a very professional experience. They communicated the expectations, time frame and cost both by phone,email and text. Exceptional service!",2024-04-19T23:45:33.000Z
The Claim service friendly and claim…,Rated 5 out of 5 stars,The Claim service friendly and claim process is easy to understand and quick.,2024-04-19T22:47:43.000Z
simple phone conversation,Rated 5 out of 5 stars,,2024-04-19T22:39:41.000Z
Professional Service,Rated 5 out of 5 stars,"Havent had the work on my vehicle done yet, but the two gentlemen online set everything up for me and approved the work. Just have to take in the car and get it done, it was a flawless procedure. Thank you Car Shield!!!!",2024-04-19T21:27:21.000Z
DENIED Claim,Rated 1 out of 5 stars,Horrible Claims Department!!!,2024-04-19T21:09:57.000Z
Course she stands behind the word everything is guaranteed 100% and ask a customer you cannot ask for more,Rated 5 out of 5 stars,"Just course you do, you advertisement IT in the other actors I got a good laugh out that the customer service the supportive enterprise that y’all have gone through  enginesrepairs coolant systems of your choice Rental reimbursement",2024-04-19T20:38:32.000Z
PLEASE READ!!!,Rated 5 out of 5 stars,"What can I say about car shield? First im a father of 6 wounderful kids ages from 17 all the way down to 4. ABOUT 2 years ago my youngest son became very ill he had 4 strokes at the age of 2 and we were in the PICU at Ou Childrens Hospital for over a month while my son fought for his life and during that time my only vehicle was the Hummer H3 and the transmission went completely out  just imagine the stress on top of stress but just a few months earlier i happened to purchase a Policy from Car Shield and Thank The Lord because here comes Car Shield to the rescue and when I needed them the most!!! THANK God... so what can I say about Car Shield  Besides how awesome they are.I've had him for a couple years now and i've had A transmission put in my hummer H3. About 2 or 3 months after I got them actually A couple years ago. anyways this year. Seem to be in having a tough time over the last couple months with the Hummer H3 from Multiple oil leaks, broken belt water pump. Etc.. and each and every time car shield was there and Got the hummer back on the road. Customer service is awesome.They call as soon as you get you Have your car towed to your mechanic..there with you every step of the way I seem genuine and caring. I don't know what I would do without Car Sheild..",2024-04-19T20:12:07.000Z
Good people to talk to that knew what…,Rated 5 out of 5 stars,Good people to talk to that knew what they were doing.,2024-04-19T20:07:18.000Z
Great customer service,Rated 5 out of 5 stars,Great service,2024-04-19T19:22:47.000Z
Car Shield  is very good…,Rated 5 out of 5 stars,"Car Shield and the Hyundai dealer were great. The technician took care of everything for us. He also gave us a ride to the rental office. Everything went smoothly. Very happy.Car Shield paid for starter, we paid for new battery. Made everything so much easier.",2024-04-19T19:17:24.000Z
Crooked Insurance Company,Rated 1 out of 5 stars,"Don't let these folks fool you. I had a catastrophic failure shortly after getting the policy. Not only did they decline it, but to add insult to injury they made the mechanic take apart my engine and then stuck me with the bill. They will look for every reason to say no. I'm now stuck with a worthless vehicle AND a bill.",2024-04-19T17:47:14.000Z
Very professional and curious they knew what they were talking about.,Rated 4 out of 5 stars,Vey professional and curious,2024-04-19T17:26:14.000Z
The advertisement  about Car 🚗  Shield…,Rated 4 out of 5 stars,"The advertisement  about Car 🚗  Shield on tv, made me choose CarTV, Shield 🛡  I've  been a happy customer for 4yrs satisfied.",2024-04-19T15:13:11.000Z
The Best Company,Rated 5 out of 5 stars,I haven’t had to use them yet but when I call they are always eager to help me with my concerns. I hope I can continue to afford them.,2024-04-19T14:45:17.000Z
My experience was very good.,Rated 5 out of 5 stars,,2024-04-19T14:09:54.000Z
The answers i needed,Rated 5 out of 5 stars,When i called customer service and needed some information about my coverage it was explained to me in a timely manner and with great respect… The person was friendly and caring as she gave me the answers to my questions…I think she did a good job and the company is doing a good service for the customers by hiring people who are willing to help their customers when needed…                                                        Thanks,2024-04-19T13:20:11.000Z
Every time I call they won't pay for…,Rated 3 out of 5 stars,Every time I call they won't pay for nothing I'm  about to cancel my membership.,2024-04-19T08:43:50.000Z
Worst experience,Rated 1 out of 5 stars,Worst experience  ever didn’t pay for anything. Never received my refund and was lied to about it . Only thing they did was pay for a rental I didn’t need because there adjuster. Wasn’t in town. Process cost more than job itself and now I’m out 200$.,2024-04-19T04:28:14.000Z
Customer service very helpful,Rated 5 out of 5 stars,,2024-04-19T03:49:06.000Z
We never got any help when we called …,Rated 1 out of 5 stars,We never got any help when we had called several times about our truck the car repair must have lied about tearing down the truck and never call us about it and when we called card shield about the matter we didn’t get any help or understanding until we talked to Ms. Ramona and she was very helpful and polite to us the other person hung up on my husband and we were going to cancel the insurance until Ms. Ramona took over thanks to her,2024-04-19T02:49:10.000Z
Good experience,Rated 5 out of 5 stars,Good experience,2024-04-19T01:57:19.000Z
Amazing for when the unexpected happens,Rated 5 out of 5 stars,Amazing for when the unexpected happens,2024-04-19T01:53:53.000Z
The representative were super…,Rated 5 out of 5 stars,The representative were super professional,2024-04-19T01:42:50.000Z
saving money,Rated 5 out of 5 stars,We had to have a sensor replaced which would have cost $1415.51 with taxes.  I gladly paid my $100 deductable.  Thank you Carshield!,2024-04-19T00:58:20.000Z
"Knowledgable staff also friendly, but professional too",Rated 5 out of 5 stars,"The staff that spoke with regarding an adjustment on the payment made were very knowledgeable , professional and friendly. I am waiting to see if a credit is actually made to my credit card. So far, so good.",2024-04-19T00:06:52.000Z
You have American auto Shield do work…,Rated 1 out of 5 stars,You have American auto Shield do work for you. I have never delt with a ruder supervisor in my whole life! Really upset. So much that I do not know if I will continue service with you and will make it known to anyone that asks.,2024-04-18T23:49:44.000Z
Car shield not honest,Rated 1 out of 5 stars,I can’t confirm a garage in my city of 80000Population that will take car shield. Car shield gave me a list of small garages from out of town which only do minor repairs. I own a Honda. Recently they list a Chevy dealer that will work on my Honda. I call this dealer up. They don’t work on Honda. It a rip off,2024-04-18T23:33:58.000Z
Great customer cservice,Rated 5 out of 5 stars,,2024-04-18T23:29:47.000Z
good experience,Rated 5 out of 5 stars,Understanding and helpful !,2024-04-18T22:40:36.000Z
Very quick to respond to questions,Rated 5 out of 5 stars,Very quick to respond to questions . Easy to talk with a real person . Comforting to know my vehicle has good repair coverage anywhere I decide !,2024-04-18T22:28:20.000Z
The first girl I talked to said my…,Rated 1 out of 5 stars,"The first girl I talked to said my wheel bearing was covered take it to the shop. When the mechanic called CarShield they said it wasn’t covered,I called the next lady I talked to said it’s not covered I asked why the First Lady said it was she claimed that lady worked for road side assistance. Basically she was sorry but I can go kick rocks.  I’m currently looking for a new provider",2024-04-18T22:21:25.000Z
You did what you said that you would do…,Rated 5 out of 5 stars,You did what you said that you would do when i needed car repairs. Keeping your word and great customer service. I appreciated how professional your people were when i needed car repairs .,2024-04-18T22:18:39.000Z
Customer service,Rated 5 out of 5 stars,I had a transmission di e on the vehicle.  They worked well with Aamco in Beaumont TX off Dowlin to resolve my issues.  Carshield has saved me over a couple thousands on my car. I really appreciate how worked with a customer.  Ty Carshield 😊.,2024-04-18T22:16:57.000Z
Good to have,Rated 5 out of 5 stars,👍🏽it was great,2024-04-18T22:03:52.000Z
Nothing was done,Rated 1 out of 5 stars,Nothing was done. You said it was covered but never paid. Waist of over 3 grand and 1st time ever having a claim.,2024-04-18T21:52:51.000Z
well for right now i still may have to…,Rated 4 out of 5 stars,well for right now i still may have to cancel my subscription due to i just got out of hospital with peuonima but i hate to loose it but my bill are tight,2024-04-18T21:48:12.000Z
I have a wonderful Representative,Rated 5 out of 5 stars,I have a wonderful Representative! He really knew his stuff and He really sold me!,2024-04-18T21:48:05.000Z
Price and quality,Rated 5 out of 5 stars,Price was great and gave us peace of mind,2024-04-18T21:30:01.000Z
Great customer service,Rated 5 out of 5 stars,,2024-04-18T21:24:53.000Z
Ease of transfer,Rated 5 out of 5 stars,,2024-04-18T20:52:41.000Z
Coordinated well,Rated 5 out of 5 stars,Worked well with the dealer…,2024-04-18T20:50:38.000Z
My dealings with Carshield have been…,Rated 5 out of 5 stars,My dealings with Carshield have been excellent! They listen to u!,2024-04-18T19:34:52.000Z
Outstanding customer service,Rated 5 out of 5 stars,Outstanding customer service,2024-04-18T19:29:34.000Z
My customer service rep was very…,Rated 5 out of 5 stars,"My customer service rep was very informative, helpful, kind and funny. She made me feel at ease and she also made my day.",2024-04-18T19:23:50.000Z
The rep I spoke with was kind &…,Rated 5 out of 5 stars,The rep I spoke with was kind & helpful. My card on file had expired so my information needed to be taken down. A confirmation was also sent as verification.,2024-04-18T19:17:58.000Z
They answered my questions quickly and…,Rated 5 out of 5 stars,They answered my questions quickly and that put me at ease!!!,2024-04-18T17:56:54.000Z
Great customer service,Rated 5 out of 5 stars,Great customer service,2024-04-18T17:27:24.000Z
Your personnel was very helpful in my…,Rated 5 out of 5 stars,Your personnel was very helpful in my time of need.Thank you sincerely for all your help!,2024-04-18T17:13:13.000Z
The customer service representative…,Rated 5 out of 5 stars,The customer service representative give me a prompt answer to my question and directed me to the right person to resolve my problem.,2024-04-18T17:06:39.000Z
The courtesy of the customer service…,Rated 5 out of 5 stars,The courtesy of the customer service and the understanding.,2024-04-18T16:39:36.000Z
Great job,Rated 5 out of 5 stars,"Great job. polite, and informed easy to talk with.",2024-04-18T15:42:15.000Z
"Well, need CarShield help again!",Rated 5 out of 5 stars,"Well, even though the starter not covered ( bummer)  carshield is willing too tow me wherever I need the truck to go. So towing is great, they gonna tow me home, until I  can fix it. Thank you much",2024-04-18T15:08:38.000Z
Tow truck was great!,Rated 5 out of 5 stars,Tow truck was great. Thought I needed to be towed but was only a battery issue. Thank God!,2024-04-18T14:58:47.000Z
was not kept informed about what was…,Rated 3 out of 5 stars,was not kept informed about what was happening and why and what needed to be done to move forward.,2024-04-18T14:58:45.000Z
It was an easy call for payment.,Rated 5 out of 5 stars,,2024-04-18T14:49:19.000Z
money i saved,Rated 5 out of 5 stars,money i saved,2024-04-18T14:09:31.000Z
Customer service quickly and…,Rated 5 out of 5 stars,Customer service quickly and efficiently resolved my issue,2024-04-18T13:56:46.000Z
It was a great experience advising you…,Rated 5 out of 5 stars,It was a great experience advising you that I already had CarshShield for the last 3 or 4 months.,2024-04-18T13:23:03.000Z
They did exactly what they said they…,Rated 5 out of 5 stars,They did exactly what they said they would do. I'm getting necessary repairs on my car.,2024-04-18T06:26:36.000Z
Just took my coverage with you,Rated 4 out of 5 stars,Just took my coverage with you. Hard to comment this early on.  From everything I’ve heard you’ve got a great reputation.,2024-04-18T05:10:08.000Z
WHAT CAN I SAY,Rated 5 out of 5 stars,"WHAT CAN I SAY  , THEY SHIELD  YOUR CAR  ! ! ! THE  BEST  PERIOD",2024-04-18T04:30:18.000Z
Customer service,Rated 4 out of 5 stars,All was great and customer support was just great,2024-04-18T04:19:41.000Z
Customer service is great,Rated 5 out of 5 stars,Customer service is great,2024-04-18T03:12:49.000Z
Customer service,Rated 5 out of 5 stars,,2024-04-18T02:56:19.000Z
Wonderful customer service!,Rated 5 out of 5 stars,,2024-04-18T02:43:58.000Z
customer service,Rated 5 out of 5 stars,,2024-04-18T02:35:11.000Z
Excellent service,Rated 5 out of 5 stars,,2024-04-18T02:09:33.000Z
Carshield always great!!…,Rated 5 out of 5 stars,The young lady that waited on me was polite and was able to take good care of me and got everything done.,2024-04-18T01:53:45.000Z
I have my car back!,Rated 5 out of 5 stars,Everyone worked to get my car fixed.,2024-04-18T01:43:20.000Z
The company is fantastic,Rated 5 out of 5 stars,The company is fantastic. Very friendly and professional.,2024-04-18T00:38:06.000Z
truck repair,Rated 5 out of 5 stars,i paid for all repairs,2024-04-18T00:36:06.000Z
They called,Rated 5 out of 5 stars,They called and reminded me that my card had to be upgraded thank you.,2024-04-18T00:01:07.000Z
everything,Rated 1 out of 5 stars,,2024-04-17T23:53:49.000Z
Carshield covered a part I needed…,Rated 5 out of 5 stars,"Carshield covered a part I needed fixed. Thank you, the claim process was quick and efficient.",2024-04-17T23:45:05.000Z
Great experience,Rated 5 out of 5 stars,"clear english speaking customer service, knew what I needed and took care of business quickly.",2024-04-17T23:19:36.000Z
Canceled coverage was told no money…,Rated 1 out of 5 stars,Canceled coverage was told no money would be taken out of my account not knowing they already had taken this months out . Called explained the problem. My wife Renee died l cannot afford carshield anymore. They don't  care will not refund my money. Low down dirty company.,2024-04-17T22:44:07.000Z
It is taking a long time to respond to…,Rated 2 out of 5 stars,"It is taking a long time to respond to a claim. Although I am given a Claim number via an email, when aI called CarShield the representative could not find any claim has been initiated and there is no info about the claim. It concerns me about the seriousness of CarShield.",2024-04-17T22:17:55.000Z
best decision I’ve made in long time. Car shieldwas great,Rated 5 out of 5 stars,Tow guy came on time like he said he would be there. Very friendly. Got my car where it needed to be. Didn’t have to spend a dime. Get car shield. U never know when u could break down. It is expensive just for a tow. Imagine cost of fixing the car. Go with car shield.,2024-04-17T22:15:39.000Z
Customer service representative was…unknown don’t remember his name,Rated 5 out of 5 stars,Customer service representative was excellent in solving my issue,2024-04-17T22:01:43.000Z
I have not had the opportunity to use…,Rated 5 out of 5 stars,"I have not had the opportunity to use your services since I have been under contract with you folks. Sure hope I never need to. I have ""banked"" 5 stars with you folks.",2024-04-17T21:57:35.000Z
Contrary to the rumors.....,Rated 5 out of 5 stars,"Contrary to the rumors of CarSheild. I've gotten nothing but GREAT service and results. My advice to the public:  Read your contract and you'll see, if ""CarSheild"" does their part and it's a little more on your end, that's a BLESSING in disguise!!....(If you take CarSheild out of the equation, you pay it ALLLLLLLL!!!) Something to think about!",2024-04-17T21:47:51.000Z
Made is easy to sign up,Rated 5 out of 5 stars,Made is easy to sign up.  Explained services.  Price is right!,2024-04-17T21:34:55.000Z
