Title,Star Rating,Main Content,Review Date
Seamless Experience,Rated 5 out of 5 stars,CarShield is a seamless process.,2024-03-05T14:03:40.000Z
Great customer service!,Rated 5 out of 5 stars,Great customer service!,2024-03-05T06:25:41.000Z
NIGHTMARE EXPERIENCE: Avoid Car Shield at ALL costs,Rated 1 out of 5 stars,"This is the worst c service I have ever had in my entire life. I mean this literally and I am not just being dramatic. I have had crappy services in before but this is by far the worst. I have also never had to write a negative review and this is my first. My car broke down and I called roadside assistance and the car was towed to my dealership as per contract. I was then told not to worry and that it would be smooth and easy between them (Car Shield) and the mechanic. All I had to do was give the mechanic my contract umber which I did.It is almost a month now and nothing had been done yet.They asked for service records and an estimate which were sent and they confirmed they received yet I keep getting messages saying that the documents were not received and I have resent them myself and even had the mechanic resend them multiple times. (Mind you, I was not even supposed to be involved in getting some of these documents; I was supposed to “sit back relax and wait”)Each time I call customer service it is the same crap. They apologize and say they will send the updated notes to an adjuster no, I  keep getting the same messages and calling them to update and getting the same rehearsed answers.I even escalated it up to “escalations” where they had me talk with a different adjuster and in a 3 way call between myself, the mechanic and the adjuster, I then thought it was all settled as it went through escalations and we provided the documentation they needed.Also Unbelievable how they provided the tow service and are still asking me for records of the tow service and other documentation which was sent multiple times. As of now, I would say I have called customer service over 12 times.At this point I am sooo frustrated that I think I will just do the repairs out of pocket and cancel this scam of a service and hopefully find something more reliable in the future. I would give zero stars if I could. WORST service ever.They are good at sales but when it comes time to honor the contract, they are Extremely reluctant to follow through.I thought it would be a couple days or at most a couple weeks but I have been without my car for almost 1 month.RIDICULOUS",2024-03-05T04:34:30.000Z
Some what helpful an talking to the…,Rated 4 out of 5 stars,Some what helpful an talking to the right person,2024-03-05T04:27:49.000Z
I want my money returned to me for many…,Rated 1 out of 5 stars,I want my money returned to me for many charges that have not been sufficient to how my plan. I have not had repairs covered after paying into this coverage. i would like $905.72 refunded. I have paid a deductible and 2 months of payments of $139.99. The coverage has now proven to be deficit and to no benefit to my expenses as proclaimed to deliver.,2024-03-05T02:18:20.000Z
RUN DO NOT USE THIS WARRANTY COMPANY,Rated 1 out of 5 stars,"RUN DO NOT USE THIS WARRANTY COMPANY!  We have been waiting 5 days for an adjustor to get their act together. First, the adjustor says to inspect vehicle physically and then does not ever show up to inspect. Second, the adjustor says they need written documentation and then once the repair shop sent it, no response from adjustor. Third, adjustor said they need pictures and the repair shop quickly send all pictures.  Again, the adjustor does not respond and we get told on 3/1/24 that pictures are still needed. Then we call Car Shield and are told the adjustor had the pictures and documentation on 3/1/24 BUT has 48 hours to review the information and approve the claim or request additional information (again).  No rental car can be obtained under this contract until the adjustor approves the claim.  WHY do we pay our premiums on time to get the run around?  Car Shield customer service reps give a long list of excuses from ""cannot see what the adjustor is doing"" to ""the system has been having glitches"" to ""well there is still 4 working day hours left for the adjustor to review the claim and respond"".  This is a HORRIBLE COMPANY - DO NOT USE THEM!   Just waiting for the adjustor say ""the differential is not covered"" when the contract says it is due to normal wear and tear - which is why it failed.",2024-03-04T23:33:45.000Z
Quick approval,Rated 5 out of 5 stars,My repairs were approved quickly. The Ford place doing the job was who took so long!!,2024-03-04T21:54:23.000Z
I needed to update my payment…,Rated 5 out of 5 stars,I needed to update my payment information and the agent on the phone was very helpful… kind and patient.,2024-03-04T21:49:59.000Z
Lies about coverage and is not clear…,Rated 1 out of 5 stars,Lies about coverage and is not clear about many things which then they tell you after when you take your car in!,2024-03-04T20:18:21.000Z
I am being honest I do not like the way…,Rated 4 out of 5 stars,I am being honest I do not like the way y’all handle handled the procedure of doing a claim. Any other warranty company that I dealt with the dealer with always do a diagnostics and not ask for that to be paid upfront. I’ve owned three different vehicles in the past him pick up a jeep patriot was insured with another company they didn’t ask for any upfront diagnostics fee they added it to the repair total on the bill and all I had to pay was $100 no why y’all asked for it out the front I don’t like the way it’s why it’s set up do you have any questions give me a call at (251) 295-1220 thank you,2024-03-04T17:57:39.000Z
I haven’t had an experience yet.,Rated 5 out of 5 stars,I haven’t had an experience yet.,2024-03-04T17:57:02.000Z
Saved me thousands!,Rated 5 out of 5 stars,Saved me thousands!Dcj,2024-03-04T17:39:19.000Z
Unbothered,Rated 5 out of 5 stars,"They did all the leg work, found the shop that participated with Car Shield which  made my job easy and painless.",2024-03-04T17:02:56.000Z
I didn't have a long wait to talk with…,Rated 5 out of 5 stars,I didn't have a long wait to talk with a representative.  My request was handled without a lot of fuss.,2024-03-04T17:00:24.000Z
Car Shield has never failed to live up…,Rated 5 out of 5 stars,Car Shield has never failed to live up to their end of the agreement between us.  Thank You Car Sheild,2024-03-04T16:44:35.000Z
Will not pay for rent a car's,Rated 1 out of 5 stars,"Will not pay for rent a car's. More than two days will not let you know they cancel You're a rental car. Any major problems with your car that's under the policy. They will not repair, they will come up with some b*******That normal warranty would not cover it Please do not deal With this company they Will not fix anything under the policy. They will is loopholes where they can get out of it. Stay away from this company",2024-03-04T12:58:43.000Z
credit card was stolen and I wasn't…,Rated 5 out of 5 stars,credit card was stolen and I wasn't sure what accounts were affected. Car Shield waited while i retrieved my replacement and corrected situation.,2024-03-04T06:34:27.000Z
Problem not covered,Rated 2 out of 5 stars,Problem not covered. Squirrels got under the hood and chewed on the wires.,2024-03-04T05:16:08.000Z
my communication--,Rated 5 out of 5 stars,OK spoke with rep/ and explain to me my account--what is covered and not covered--with good communication that I understood---,2024-03-04T03:01:42.000Z
Great job by a very engaging rep…,Rated 5 out of 5 stars,Great job by a very engaging rep re-signing me,2024-03-04T01:53:23.000Z
Knowledgeable and very helpful when it…,Rated 5 out of 5 stars,Knowledgeable and very helpful when it came to selecting shop.,2024-03-04T01:00:34.000Z
You guys take care of business,Rated 5 out of 5 stars,"You guys take care of business, all in all a nice experience",2024-03-03T21:03:50.000Z
4 stars as I Did not need to use for…,Rated 4 out of 5 stars,4 stars as I Did not need to use for the 2 years I had plan.  Bought new vehicle.  Cancellation was easy.   Representative I spoke  with was courteous and efficient.,2024-03-03T19:45:07.000Z
Your people are very helpfull,Rated 5 out of 5 stars,,2024-03-03T18:19:01.000Z
Just knowing that I have that is a big relief and Imm not sure if my account is still active cuz your not taking the money off my bank card,Rated 5 out of 5 stars,Great so far I have'nt used itcan u see if I'm still active,2024-03-03T17:27:59.000Z
The people are very polite and took…,Rated 5 out of 5 stars,The people are very polite and took care of all my problems very quick. They were very knowledgeable,2024-03-03T16:57:43.000Z
"I recommend CarShield to everyone, my experience with CarShield has been great I had no problems at all. It’s good to have when your warranty expires I am very satisfied.",Rated 5 out of 5 stars,"What made my experience great is I don’t have to do anything, I take my truck to my mechanic and he do all the work from talking to the people and make the repairs. Very satisfied!!",2024-03-03T16:23:11.000Z
There is only 1 shop in my town that…,Rated 2 out of 5 stars,There is only 1 shop in my town that accepts CarShield and I went by there and was not impressed at all. I am going to can CarShield. I can not drive to the next town for car repairs if needed.,2024-03-03T15:52:53.000Z
The lady that I spoke with was great to…,Rated 5 out of 5 stars,The lady that I spoke with was great to talk with new all the in and outs about CarShield and explained everything in great detail for me.,2024-03-03T14:20:06.000Z
Well to be honest about I was looking…,Rated 5 out of 5 stars,Well to be honest about I was looking for more bang for my money and the quote sold me.,2024-03-03T02:16:28.000Z
They understood the situation I was in…,Rated 5 out of 5 stars,They understood the situation I was in financially and helped lower my rate,2024-03-03T02:11:35.000Z
Idk?,Rated 4 out of 5 stars,Idk yet let's see how this claim goes if and when I need one.,2024-03-03T01:27:49.000Z
They made it hard to refuse,Rated 5 out of 5 stars,They made it hard to refuse,2024-03-03T00:28:20.000Z
I give her a 100% in customer service.,Rated 5 out of 5 stars,I give her a 100% in customer service.,2024-03-03T00:24:37.000Z
Rep very knowledgeable,Rated 4 out of 5 stars,,2024-03-02T23:21:07.000Z
Excellent,Rated 5 out of 5 stars,Great communication. Great service,2024-03-02T22:23:20.000Z
Spam,Rated 3 out of 5 stars,"My cs rep was unable to tell me why, after starting my policy months ago, I received a letter saying I had not initiated my service. I have been paying for months, what was this all about? Different departments not following up on current customers? Good way to distrust a company’s procedures. My cs did try to help but not being able to tell me where the problem lies, I’ve given this policy second thoughts.",2024-03-02T22:07:02.000Z
Never had to call,Rated 5 out of 5 stars,"Never had to call, but I felt protected.",2024-03-02T22:01:58.000Z
Knowledgeable efficient assistance,Rated 5 out of 5 stars,Knowledgeable efficient assistance. Thank You.,2024-03-02T20:29:57.000Z
Excellent customer service.,Rated 5 out of 5 stars,The lady assisting me informed me of a different payment system. It saves me money and I took her advice.,2024-03-02T20:25:41.000Z
Excellent customer service,Rated 5 out of 5 stars,Excellent customer service,2024-03-02T19:44:43.000Z
They are very professional and I like…,Rated 5 out of 5 stars,They are very professional and I like that in a company.,2024-03-02T19:29:43.000Z
your people were so nice,Rated 5 out of 5 stars,,2024-03-02T18:58:05.000Z
The representative was very kind and…,Rated 5 out of 5 stars,The representative was very kind and knowledgeable,2024-03-02T18:44:41.000Z
Customer service was easy to work with.,Rated 5 out of 5 stars,,2024-03-02T18:30:48.000Z
Great customer service,Rated 4 out of 5 stars,"Great customer service. However, there were times we had to wait a while to hear back on a claim.",2024-03-02T18:05:02.000Z
The Car Shield reps are so terrific,Rated 5 out of 5 stars,"The Car Shield reps are so terrific! I was going to cancel with them as I have an upcoming surgery, but they found a way to lower my payments while I am recuperating. They went above and beyond, and I thank them so much.",2024-03-02T18:01:20.000Z
Price,Rated 5 out of 5 stars,Price  very polite and helpful and easy to understand what you a cover at car shield,2024-03-02T17:57:42.000Z
Very friendly and knowledgeable,Rated 5 out of 5 stars,Very friendly and knowledgeable,2024-03-02T16:44:06.000Z
I received a letter advising me that my…,Rated 5 out of 5 stars,I received a letter advising me that my policy had expired.  Customer representative was very helpful and professional and explained everything at a level I could understand.,2024-03-02T16:37:01.000Z
So I was driving back from Dallas the…,Rated 5 out of 5 stars,"So I was driving back from Dallas the trip was about 400 miles and on the was back my truck started running funny and check eng slight come on so I stoped and it was making a funny sound I called and had it towed to a preferred vendor and the dealership said it needs a new eng 13,000 and it got submitted to car shield and they only approved it for 2,400 and some Chang so I disputed it and was denied they said it was driven a extended amount of time and I ask them how lone is a extended amount of time was five minutes or so we’ll and then I ask them how I could tell something was wrong if no check Eng light was on and he told me he had no idea he was not a mechanic and did not know how a person would no if something was wrong with out a check Eng light on so I did not drive the vehicle after we herd the funny sound and light come on this is the best ripoff money can buy they will not pay for the repairs even when it said in the book we got that any repair that need to be done will be covered if it was damaged by a coverd part we they lie and lie and lie even if you have been a customer over five years they will take your money and still leave you high and dry I will be suing them for the not paying for the hole clam",2024-03-02T09:03:22.000Z
Notice,Rated 5 out of 5 stars,"Notice, no monthly payment....I called ,,, I had received new card and just had to give girl new info.....took less than 10min. Great.",2024-03-02T05:46:15.000Z
The agent was able to fix the issue…,Rated 5 out of 5 stars,The agent was able to fix the issue immediately.,2024-03-02T04:36:48.000Z
They are great,Rated 5 out of 5 stars,They are great.  Used it twice and saved 8000 dollars.   You wont miss with Car Shield,2024-03-02T03:37:45.000Z
Phone conversation,Rated 4 out of 5 stars,Representative was courteous. Explanation of coverage was understandable.,2024-03-02T03:30:07.000Z
WHEN MY TRUCK  NEEDED  REPAIR 👍CAR…,Rated 5 out of 5 stars,WHEN MY TRUCK  NEEDED  REPAIR 👍CAR SHIELD WAS THERE,2024-03-02T02:21:50.000Z
All good in Selma,Rated 5 out of 5 stars,"All good in Selma, Alabama",2024-03-02T02:00:21.000Z
Mail and why?,Rated 5 out of 5 stars,Got mail notice and called to ask why?,2024-03-02T01:40:51.000Z
Agent answered my questions in a timely…,Rated 5 out of 5 stars,Agent answered my questions in a timely manner.,2024-03-02T01:39:01.000Z
It has been a bumpy start with Car…,Rated 4 out of 5 stars,It has been a bumpy start with Car Shield. Fine print will come back to bite ya. All in all a positive experience. Sometimes it's about WHO answers when you contact them. App works well but Thanks to the mechanic for knowing the process.,2024-03-02T01:36:06.000Z
Easy to interface with CarShield,Rated 5 out of 5 stars,"Easy to interface with CarShield, good customer service, seems a good product (though fortunately I never needed it)",2024-03-02T01:19:54.000Z
Very helpful,Rated 5 out of 5 stars,Very helpful,2024-03-02T01:10:17.000Z
Everything is ok,Rated 5 out of 5 stars,Everything is ok. The quote was quite fair.,2024-03-02T00:14:26.000Z
Am a new customer,Rated 5 out of 5 stars,"Am a new customer, but customer service has been very good so far.",2024-03-02T00:13:10.000Z
Don't like being transferred to people…,Rated 3 out of 5 stars,Don't like being transferred to people after giving all the information to the first person,2024-03-01T22:41:43.000Z
Very good experience professional…,Rated 5 out of 5 stars,Very good experience professional service great people fast and on top of everything great job keep the good job God Bless You All,2024-03-01T22:18:21.000Z
It was easy n great to talk to alive…,Rated 5 out of 5 stars,It was easy n great to talk to alive person.,2024-03-01T21:56:26.000Z
I didn't have to do anything other than…,Rated 5 out of 5 stars,I didn't have to do anything other than give my acct. info to the dealership service rep. They made the estimate and took care of everything else.,2024-03-01T20:52:35.000Z
Just knowing they had my back when car…,Rated 5 out of 5 stars,Just knowing they had my back when car problems occurred .,2024-03-01T20:50:31.000Z
Would not cover auto due to not being covered in my area. Refund is being pursued.,Rated 1 out of 5 stars,Would not cover auto due to underwriter losing credit,2024-03-01T19:36:05.000Z
Car Shield is a RIP OFF,Rated 1 out of 5 stars,"Car Shield is a RIP OFF.  Ice Tea and Vivica Fox need to be ashamed of themselves for their Commercials advertising for Carshield, but of course they don't care how they deceive people, they are actors and are only in it for the MONEY.  I've had my contract with Carshield for 3 years now, and this is the first time that I have needed to use it. I found that The Contract gives very limited information about WHAT IS COVERED but when you have a problem with your car, then VERY DETAILED information of what is NOT COVERED comes to light. After diagnosis of What the problem is, what caused the problem, and what the cost will be to fix it, The Claim still has to go to an Adjuster before it is approved.  No specific time frame on when the Adjuster will adjudicate your claim. You can not get a renter vehicle until the Adjuster approves the claim.  In the mean time, you can either rent a car, out of your own pocket (non-reimbursable), it doesn't matter how long your vehicle has to be with the Dealership.  One day or whatever, in my case 3 wks, before they can even get it diagnosed, you are left without a vehicle.  After the adjuster FINALLY approves the claim, they will set you up in a rental vehicle. You will find that they only pay $40 flat OUT OF THEIR POCKETS for each day of the rental and YOU pay for the taxes on that vehicle and an additional $10 for each day's use of that vehicle. The rental is only approved for 14 days and after you return the vehicle, supposedly, they reimburse the extra $10 dollars you have paid for those 14 days but they do not reimburse the taxes that you have paid for those 14 dys. If you want to go with this company BE VERY AWARE, ASK QUESTIONS ON THE CONTRACT UP FRONT, WHAT IS NOT COVERED. THEY CONVENIENTLY LEAVE THAT PART OUT AND PLEASE, PLEASE,  PLEASE THE FINE PRINT.",2024-03-01T19:27:12.000Z
Representative was very helpful and…,Rated 5 out of 5 stars,Representative was very helpful and professional,2024-03-01T19:06:03.000Z
Communication,Rated 5 out of 5 stars,I was kept informed through emails.,2024-03-01T18:48:27.000Z
I’m very Satisfied with the level of…,Rated 5 out of 5 stars,I’m very Satisfied with the level of service and support they have given me. Carsheild is always willing to work with the repair shop that I due business with. I’m a Satisfied Customer.,2024-03-01T17:57:10.000Z
I’ve been with carshield for several…,Rated 5 out of 5 stars,I’ve been with carshield for several years now I’ve only had to use them once but I had no problem I got my truck fixed with several days of submitting my claim that’s why I’m a true customer,2024-03-01T16:43:07.000Z
Customer service,Rated 4 out of 5 stars,Customer service,2024-03-01T12:59:01.000Z
Very kind and understood my concern,Rated 5 out of 5 stars,Very kind and understood my concern,2024-03-01T05:09:33.000Z
quick response time,Rated 5 out of 5 stars,,2024-03-01T04:00:58.000Z
Good service personnel,Rated 4 out of 5 stars,All questions were answered very quickly and efficiently. Everyone I've spoken to have been very professional and easy to talk to.,2024-03-01T03:18:09.000Z
Grateful for the amount of coverage.,Rated 4 out of 5 stars,"Was grateful for the amount of coverage for the repair, however, it wasn't fully covered and unsure why. Process was easy.",2024-03-01T03:15:30.000Z
The Customer Service Representatives,Rated 5 out of 5 stars,The Customer Service Representatives,2024-03-01T02:45:39.000Z
The lady I spoke with was good,Rated 4 out of 5 stars,The lady I spoke with was good.  Very helpful and nice.,2024-03-01T01:21:30.000Z
Car Shield paid for everything to…,Rated 5 out of 5 stars,Car Shield paid for everything to replace my transmission and I was totally pleased.,2024-03-01T01:10:55.000Z
the agent knew how to explain all…,Rated 5 out of 5 stars,the agent knew how to explain all different advantages of the program he knew his stuff,2024-03-01T00:59:40.000Z
Easy to sign up for,Rated 4 out of 5 stars,Easy to sign up for. Easy to cancel,2024-03-01T00:10:32.000Z
Each an every time I need car shield…,Rated 5 out of 5 stars,Each an every time I need car shield they have been there for me an took care of the bill with very little out of the pocket money from me.,2024-02-29T23:29:09.000Z
I am very greatful for the amount that…,Rated 5 out of 5 stars,I am very greatful for the amount that was given to me hope it will help me when needed,2024-02-29T23:10:30.000Z
Timely operator courtesy informational …,Rated 5 out of 5 stars,Timely operator courtesy informational  and time consciousness! It did not take all day to accomplish the task!,2024-02-29T23:07:23.000Z
Contract Cancellation,Rated 5 out of 5 stars,The response of your customer service to my request.,2024-02-29T23:05:02.000Z
Called and informed my vehicle was in…,Rated 1 out of 5 stars,Called and informed my vehicle was in an accident and was damaged pretty bad asked if I can place my account on hold to see if the insurance was going to cancel it out instead of paying another premium and for me that if the vehicle was totaled out they would transfer everything over to the new vehicle when I got one I did get a new vehicle and they pretty much told me the complete opposite gave them a free month of premiums and when I added the new vehicle they said that my vehicle will be added on to a new policy and will not go into effect for 3 weeks do not recommend this company full of lies and waste of money,2024-02-29T23:01:00.000Z
Customer service,Rated 5 out of 5 stars,Customer service,2024-02-29T22:49:33.000Z
I don't know,Rated 3 out of 5 stars,I haven't used Car Shield so l am not able to review.,2024-02-29T22:40:01.000Z
Very good customer service,Rated 5 out of 5 stars,Very good customer service,2024-02-29T22:37:27.000Z
Horrible customer service,Rated 1 out of 5 stars,I want to know why I was cancelled for submitting a claim,2024-02-29T22:29:32.000Z
Keep it up by training your employees,Rated 5 out of 5 stars,Keep it up by training your employees,2024-02-29T22:27:13.000Z
Recently had dealings with your staff…,Rated 5 out of 5 stars,Recently had dealings with your staff and everything worked out to our satisfaction. Thank you,2024-02-29T22:25:28.000Z
When you need to get your information…,Rated 5 out of 5 stars,"When you need to get your information to the correct person, they know exactly where to send you. I found them to be friendly but very professional.",2024-02-29T21:59:16.000Z
You guys do not cover anything and I…,Rated 1 out of 5 stars,You guys do not cover anything and I still had to pay out of pocket when I’m supposed to be covered by warranty with your company. I am not a happy customer and I do understand the warranty I have I read what was covered and what wasn’t so that is why I am not pleased because what needed to be fixed was supposed to be covered under my warranty.,2024-02-29T20:07:41.000Z
Bait and Switch warranty.,Rated 1 out of 5 stars,"My experience with this company is that they are misleading, a bait-and-switch plan where you over-promise and under-deliver. Good business is based on trust, and this company is not to be trusted.  It's been a horrible experience filing a claim. They only wanted to cover about 20% of the bill.  What a joke. One company, Car Shield, sells you the policy, and another entity, American Auto Sheild, deals with your claim.  Good luck saving much with these people. When we saw their commercial with one of our favorite actors (Ice-T), we figured they were legit.  All of the people they feature in theirad show customers saving thousands (one woman bragged about using the savings to go on vacation with the $1000 you saved her, and another guy said you saved him over $3600).  It is a complete insult to hear that you would only consider covering so very little ($400 on a $2200 repair bill).The reality is, they are not covering what they boast. They want to put in cheap or used parts.  Using cheap parts is like putting GMOs in our bodies. Not kosher and harmful.I will be canceling the policy. It's a rip-off and not worth the agony and stress.",2024-02-29T19:21:43.000Z
I changed my mind and the cancellation…,Rated 5 out of 5 stars,I changed my mind and the cancellation was swift and easy.,2024-02-29T18:01:34.000Z
You lowered my bill thank you so much…,Rated 5 out of 5 stars,You lowered my bill thank you so much and answered all my questions.,2024-02-29T17:26:07.000Z
